https://github.com/espressif/arduino-esp32/issues/118
https://github.com/espressif/arduino-esp32/pull/5746


*D�T\�ͥ�� 0, SPIWP:0xee
clk_drv:0x00,q_drv:0x00,d_drv:0x00,cs0_drv:0x00,hd_drv:0x00,wp_drv:0x00
mode:DIO, clock div:2
load:0x3fff0030,len:1184
load:0x40078000,len:13132
load:0x40080400,len:3036
entry 0x400805e4
Waiting 9 seconds to start: 1
Waiting 9 seconds to start: 2
Waiting 9 seconds to start: 3
Waiting 9 seconds to start: 4
Waiting 9 seconds to start: 5
Waiting 9 seconds to start: 6
Waiting 9 seconds to start: 7
Waiting 9 seconds to start: 8
Waiting 9 seconds to start: 9
I2C receiver Arduino-Pico example using i2c baud rate: 400000
DEBUG_SERIAL_DURING_I2C_RECEIVE: true
DEBUG_SERIAL_DURING_I2C_RESPONSE: true

I2C Receiver says: After reading I2C data from RX, the value: 0xFF (255) (buffer size) and then the following buffer will be written to the sender:
FF FE FD FC FB FA F9 F8 F7 F6 F5 F4 F3 F2 F1 F0
EF EE ED EC EB EA E9 E8 E7 E6 E5 E4 E3 E2 E1 E0
DF DE DD DC DB DA D9 D8 D7 D6 D5 D4 D3 D2 D1 D0
CF CE CD CC CB CA C9 C8 C7 C6 C5 C4 C3 C2 C1 C0
BF BE BD BC BB BA B9 B8 B7 B6 B5 B4 B3 B2 B1 B0
AF AE AD AC AB AA A9 A8 A7 A6 A5 A4 A3 A2 A1 A0
9F 9E 9D 9C 9B 9A 99 98 97 96 95 94 93 92 91 90
8F 8E 8D 8C 8B 8A 89 88 87 86 85 84 83 82 81 80
7F 7E 7D 7C 7B 7A 79 78 77 76 75 74 73 72 71 70
6F 6E 6D 6C 6B 6A 69 68 67 66 65 64 63 62 61 60
5F 5E 5D 5C 5B 5A 59 58 57 56 55 54 53 52 51 50
4F 4E 4D 4C 4B 4A 49 48 47 46 45 44 43 42 41 40
3F 3E 3D 3C 3B 3A 39 38 37 36 35 34 33 32 31 30
2F 2E 2D 2C 2B 2A 29 28 27 26 25 24 23 22 21 20
1F 1E 1D 1C 1B 1A 19 18 17 16 15 14 13 12 11 10
0F 0E 0D 0C 0B 0A 09 08 07 06 05 04 03 02 01

Guru Meditation Error: Core  1 panic'ed (Interrupt wdt timeout on CPU1).

Core  1 register dump:
PC      : 0x4008a654  PS      : 0x00060935  A0      : 0x800898aa  A1      : 0x3ffbed7c
A2      : 0x3ffb8a00  A3      : 0x3ffb8890  A4      : 0x00000004  A5      : 0x00060923
A6      : 0x00060923  A7      : 0x00000001  A8      : 0x3ffb8890  A9      : 0x00000018
A10     : 0x3ffb8890  A11     : 0x00000018  A12     : 0x00000004  A13     : 0x00060923
A14     : 0x007bef18  A15     : 0x003fffff  SAR     : 0x00000010  EXCCAUSE: 0x00000006
EXCVADDR: 0x00000000  LBEG    : 0x400861e5  LEND    : 0x400861f5  LCOUNT  : 0xfffffff9
Core  1 was running in ISR context:
EPC1    : 0x400dbc8b  EPC2    : 0x00000000  EPC3    : 0x00000000  EPC4    : 0x00000000


Backtrace:0x4008a651:0x3ffbed7c |<-CORRUPTED


Core  0 register dump:
PC      : 0x4008a7d1  PS      : 0x00060035  A0      : 0x800894d3  A1      : 0x3ffbe86c
A2      : 0x3ffbef18  A3      : 0xb33fffff  A4      : 0x0000abab  A5      : 0x00060023
A6      : 0x00060021  A7      : 0x0000cdcd  A8      : 0x0000cdcd  A9      : 0xffffffff
A10     : 0x00000000  A11     : 0x00000000  A12     : 0x3ffc19d0  A13     : 0x00000007
A14     : 0x007bef18  A15     : 0x003fffff  SAR     : 0x0000001a  EXCCAUSE: 0x00000006
EXCVADDR: 0x00000000  LBEG    : 0x00000000  LEND    : 0x00000000  LCOUNT  : 0x00000000


Backtrace:0x4008a7ce:0x3ffbe86c |<-CORRUPTED




ELF file SHA256: 0000000000000000

Rebooting...
ets Jun  8 2016 00:22:57

rst:0xc (SW_CPU_RESET),boot:0x13 (SPI_FAST_FLASH_BOOT)
configsip: 0, SPIWP:0xee
clk_drv:0x00,q_drv:0x00,d_drv:0x00,cs0_drv:0x00,hd_drv:0x00,wp_drv:0x00
mode:DIO, clock div:2
load:0x3fff0030,len:1184
load:0x40078000,len:13132
load:0x40080400,len:3036
entry 0x400805e4
Waiting 9 seconds to start: 1
Waiting 9 seconds to start: 2
Waiting 9 seconds to start: 3
Waiting 9 seconds to start: 4
Waiting 9 seconds to start: 5
Waiting 9 seconds to start: 6
Waiting 9 seconds to start: 7
Waiting 9 seconds to start: 8
Waiting 9 seconds to start: 9
I2C receiver Arduino-Pico example using i2c baud rate: 400000
DEBUG_SERIAL_DURING_I2C_RECEIVE: true
DEBUG_SERIAL_DURING_I2C_RESPONSE: true

I2C Receiver says: After reading I2C data from RX, the value: 0xFF (255) (buffer size) and then the following buffer will be written to the sender:
FF FE FD FC FB FA F9 F8 F7 F6 F5 F4 F3 F2 F1 F0
EF EE ED EC EB EA E9 E8 E7 E6 E5 E4 E3 E2 E1 E0
DF DE DD DC DB DA D9 D8 D7 D6 D5 D4 D3 D2 D1 D0
CF CE CD CC CB CA C9 C8 C7 C6 C5 C4 C3 C2 C1 C0
BF BE BD BC BB BA B9 B8 B7 B6 B5 B4 B3 B2 B1 B0
AF AE AD AC AB AA A9 A8 A7 A6 A5 A4 A3 A2 A1 A0
9F 9E 9D 9C 9B 9A 99 98 97 96 95 94 93 92 91 90
8F 8E 8D 8C 8B 8A 89 88 87 86 85 84 83 82 81 80
7F 7E 7D 7C 7B 7A 79 78 77 76 75 74 73 72 71 70
6F 6E 6D 6C 6B 6A 69 68 67 66 65 64 63 62 61 60
5F 5E 5D 5C 5B 5A 59 58 57 56 55 54 53 52 51 50
4F 4E 4D 4C 4B 4A 49 48 47 46 45 44 43 42 41 40
3F 3E 3D 3C 3B 3A 39 38 37 36 35 34 33 32 31 30
2F 2E 2D 2C 2B 2A 29 28 27 26 25 24 23 22 21 20
1F 1E 1D 1C 1B 1A 19 18 17 16 15 14 13 12 11 10
0F 0E 0D 0C 0B 0A 09 08 07 06 05 04 03 02 01

Guru Meditation Error: Core  1 panic'ed (Interrupt wdt timeout on CPU1).

Core  1 register dump:
PC      : 0x4008a656  PS      : 0x00060935  A0      : 0x800898aa  A1      : 0x3ffbed7c
A2      : 0x3ffb8a00  A3      : 0x3ffb8890  A4      : 0x00000004  A5      : 0x00060923
A6      : 0x00060923  A7      : 0x00000001  A8      : 0x3ffb8890  A9      : 0x00000018
A10     : 0x3ffb8890  A11     : 0x00000018  A12     : 0x00000004  A13     : 0x00060923
A14     : 0x007bef18  A15     : 0x003fffff  SAR     : 0x00000010  EXCCAUSE: 0x00000006
EXCVADDR: 0x00000000  LBEG    : 0x400861e5  LEND    : 0x400861f5  LCOUNT  : 0xfffffff9
Core  1 was running in ISR context:
EPC1    : 0x400dbc8b  EPC2    : 0x00000000  EPC3    : 0x00000000  EPC4    : 0x00000000


Backtrace:0x4008a653:0x3ffbed7c |<-CORRUPTED


Core  0 register dump:
PC      : 0x4008a7d7  PS      : 0x00060035  A0      : 0x800894d3  A1      : 0x3ffbe86c
A2      : 0x3ffbef18  A3      : 0xb33fffff  A4      : 0x0000abab  A5      : 0x00060023
A6      : 0x00060021  A7      : 0x0000cdcd  A8      : 0x0000abab  A9      : 0xffffffff
A10     : 0x3ffc19d4  A11     : 0x00000000  A12     : 0x3ffc19d0  A13     : 0x00000007
A14     : 0x007bef18  A15     : 0x003fffff  SAR     : 0x0000001a  EXCCAUSE: 0x00000006
EXCVADDR: 0x00000000  LBEG    : 0x00000000  LEND    : 0x00000000  LCOUNT  : 0x00000000


Backtrace:0x4008a7d4:0x3ffbe86c |<-CORRUPTED




ELF file SHA256: 0000000000000000

Rebooting...
ets Jun  8 2016 00:22:57

rst:0xc (SW_CPU_RESET),boot:0x13 (SPI_FAST_FLASH_BOOT)
configsip: 0, SPIWP:0xee
clk_drv:0x00,q_drv:0x00,d_drv:0x00,cs0_drv:0x00,hd_drv:0x00,wp_drv:0x00
mode:DIO, clock div:2
load:0x3fff0030,len:1184
load:0x40078000,len:13132
load:0x40080400,len:3036
entry 0x400805e4
Waiting 9 seconds to start: 1
Waiting 9 seconds to start: 2
Waiting 9 seconds to start: 3
Waiting 9 seconds to start: 4
Waiting 9 seconds to start: 5
Waiting 9 seconds to start: 6
Waiting 9 seconds to start: 7
Waiting 9 seconds to start: 8
Waiting 9 seconds to start: 9
I2C receiver Arduino-Pico example using i2c baud rate: 400000
DEBUG_SERIAL_DURING_I2C_RECEIVE: true
DEBUG_SERIAL_DURING_I2C_RESPONSE: true

I2C Receiver says: After reading I2C data from RX, the value: 0xFF (255) (buffer size) and then the following buffer will be written to the sender:
FF FE FD FC FB FA F9 F8 F7 F6 F5 F4 F3 F2 F1 F0
EF EE ED EC EB EA E9 E8 E7 E6 E5 E4 E3 E2 E1 E0
DF DE DD DC DB DA D9 D8 D7 D6 D5 D4 D3 D2 D1 D0
CF CE CD CC CB CA C9 C8 C7 C6 C5 C4 C3 C2 C1 C0
BF BE BD BC BB BA B9 B8 B7 B6 B5 B4 B3 B2 B1 B0
AF AE AD AC AB AA A9 A8 A7 A6 A5 A4 A3 A2 A1 A0
9F 9E 9D 9C 9B 9A 99 98 97 96 95 94 93 92 91 90
8F 8E 8D 8C 8B 8A 89 88 87 86 85 84 83 82 81 80
7F 7E 7D 7C 7B 7A 79 78 77 76 75 74 73 72 71 70
6F 6E 6D 6C 6B 6A 69 68 67 66 65 64 63 62 61 60
5F 5E 5D 5C 5B 5A 59 58 57 56 55 54 53 52 51 50
4F 4E 4D 4C 4B 4A 49 48 47 46 45 44 43 42 41 40
3F 3E 3D 3C 3B 3A 39 38 37 36 35 34 33 32 31 30
2F 2E 2D 2C 2B 2A 29 28 27 26 25 24 23 22 21 20
1F 1E 1D 1C 1B 1A 19 18 17 16 15 14 13 12 11 10
0F 0E 0D 0C 0B 0A 09 08 07 06 05 04 03 02 01

Guru Meditation Error: Core  1 panic'ed (Interrupt wdt timeout on CPU1).

Core  1 register dump:
PC      : 0x4008a652  PS      : 0x00060935  A0      : 0x800898aa  A1      : 0x3ffbed7c
A2      : 0x3ffb8a00  A3      : 0x3ffb8890  A4      : 0x00000004  A5      : 0x00060923
A6      : 0x00060923  A7      : 0x00000001  A8      : 0x3ffb8890  A9      : 0x00000018
A10     : 0x3ffb8890  A11     : 0x00000018  A12     : 0x00000004  A13     : 0x00060923
A14     : 0x007bef18  A15     : 0x003fffff  SAR     : 0x00000010  EXCCAUSE: 0x00000006
EXCVADDR: 0x00000000  LBEG    : 0x400861e5  LEND    : 0x400861f5  LCOUNT  : 0xfffffff9
Core  1 was running in ISR context:
EPC1    : 0x400dbc8b  EPC2    : 0x00000000  EPC3    : 0x00000000  EPC4    : 0x00000000


Backtrace:0x4008a64f:0x3ffbed7c |<-CORRUPTED


Core  0 register dump:
PC      : 0x4008a7d4  PS      : 0x00060035  A0      : 0x800894d3  A1      : 0x3ffbe86c
A2      : 0x3ffbef18  A3      : 0xb33fffff  A4      : 0x0000abab  A5      : 0x00060023
A6      : 0x00060021  A7      : 0x0000cdcd  A8      : 0x0000cdcd  A9      : 0xffffffff
A10     : 0x00000000  A11     : 0x00000000  A12     : 0x3ffc19d0  A13     : 0x00000007
A14     : 0x007bef18  A15     : 0x003fffff  SAR     : 0x0000001a  EXCCAUSE: 0x00000006
EXCVADDR: 0x00000000  LBEG    : 0x00000000  LEND    : 0x00000000  LCOUNT  : 0x00000000


Backtrace:0x4008a7d1:0x3ffbe86c |<-CORRUPTED




ELF file SHA256: 0000000000000000

Rebooting...
